{
  "$id": "https://example.com/address.schema.json",
  "$schema": "http://json-schema.org/draft-07/schema#",
  "definitions": {
    "statusDetails": {
      "type": "object",
      "properties": {
        "slack": {
          "type": "object",
          "properties": {
            "emoji_name": {
              "type": "string"
            }
          },
          "required": ["emoji_name"]
        },
        "github": {
          "type": "object",
          "properties": {
            "emoji_name": {
              "type": "string"
            }
          },
          "required": ["emoji_name"]
        },
        "text": {"type": "string"}
      }
    }
  },
  "type": "object",
  "properties": {
    "ğŸ¯": {
      "$ref": "#/definitions/statusDetails"
    },
    "â˜•": {
      "$ref": "#/definitions/statusDetails"
    },
    "ğŸ—“": {
      "$ref": "#/definitions/statusDetails"
    },
    "ğŸšŒ": {
      "$ref": "#/definitions/statusDetails"
    },
    "ğŸŒ´": {
      "$ref": "#/definitions/statusDetails"
    },
    "ğŸ¡": {
      "$ref": "#/definitions/statusDetails"
    },
    "ğŸ¤’": {
      "$ref": "#/definitions/statusDetails"
    }
  },
  "required": ["ğŸ¯", "â˜•", "ğŸ—“", "ğŸšŒ", "ğŸŒ´", "ğŸ¡", "ğŸ¤’"],
  "additionalProperties": false
}
