{
  "ğŸ¯": {
    "slack": {
      "emoji_name": "dart"
    },
    "github": {
      "emoji_name": "dart"
    },
    "text": "Focusing"
  },
  "â˜•": {
    "slack": {
      "emoji_name": "coffee"
    },
    "github": {
      "emoji_name": "coffee"
    },
    "text": "Taking a break"
  },
  "ğŸ—“": {
    "slack": {
      "emoji_name": "spiral_calendar_pad"
    },
    "github": {
      "emoji_name": "spiral_calendar"
    },
    "text": "In a meeting"
  },
  "ğŸšŒ": {
    "slack": {
      "emoji_name": "bus"
    },
    "github": {
      "emoji_name": "bus"
    },
    "text": "On my way to work"
  },
  "ğŸŒ´": {
    "slack": {
      "emoji_name": "palm_tree"
    },
    "github": {
      "emoji_name": "palm_tree"
    },
    "text": "On Vacation"
  },
  "ğŸ¡": {
    "slack": {
      "emoji_name": "house_with_garden"
    },
    "github": {
      "emoji_name": "house_with_garden"
    },
    "text": "Working from home"
  },
  "ğŸ¤’": {
    "slack": {
      "emoji_name": "face_with_thermometer"
    },
    "github": {
      "emoji_name": "face_with_thermometer"
    },
    "text": "Out sick"
  }
}
