{
  "ğŸ¯": {
    "slack": {
      "emoji_name": "dart"
    },
    "github": {
      "emoji_name": "dart"
    },
    "text": "é›†ä¸­"
  },
  "â˜•": {
    "slack": {
      "emoji_name": "coffee"
    },
    "github": {
      "emoji_name": "coffee"
    },
    "text": "ä¼‘æ†©ä¸­"
  },
  "ğŸ—“": {
    "slack": {
      "emoji_name": "spiral_calendar_pad"
    },
    "github": {
      "emoji_name": "spiral_calendar"
    },
    "text": "ä¼šè­°ä¸­"
  },
  "ğŸšŒ": {
    "slack": {
      "emoji_name": "bus"
    },
    "github": {
      "emoji_name": "bus"
    },
    "text": "é€šå‹¤é€”ä¸­"
  },
  "ğŸŒ´": {
    "slack": {
      "emoji_name": "palm_tree"
    },
    "github": {
      "emoji_name": "palm_tree"
    },
    "text": "ä¼‘æš‡ä¸­"
  },
  "ğŸ¡": {
    "slack": {
      "emoji_name": "house_with_garden"
    },
    "github": {
      "emoji_name": "house_with_garden"
    },
    "text": "ãƒªãƒ¢ãƒ¼ãƒˆã§ä½œæ¥­ä¸­"
  },
  "ğŸ¤’": {
    "slack": {
      "emoji_name": "face_with_thermometer"
    },
    "github": {
      "emoji_name": "face_with_thermometer"
    },
    "text": "ç—…æ¬ "
  }
}
